{
  "saksnummer": "MELTEST-1",
  "avsenderID": "30098000492",
  "avsenderNavn": "PEN FUL",
  "brukerID": "30098000492",
  "dokumentID": "Dok_ID",
  "dokumenttittel": "SÃ¸knad om medlemskap",
  "journalpostID": "DOK_321",
  "oppgaveID": "177057928",
  "vedleggstitler": [
    "Vedleggstittel 1"
  ]
}
